{
  "feed_id": "taxii_feed_cisa_kev_001",
  "tenant_id": "tenant-enterprise-cyber",
  "collection": {
    "id": "528e2091-95fc-497d-82d9-1149e64e0a9b",
    "title": "CISA Known Exploited Vulnerabilities Catalog Feed",
    "description": "Authoritative TAXII 2.1 collection stream of CISA KEV catalog entries.",
    "alias": "cisa-kev",
    "can_read": true,
    "can_write": false,
    "media_types": ["application/taxii+json;version=2.1", "application/stix+json;version=2.1"]
  },
  "polling_parameters": {
    "added_after": "2026-09-01T00:00:00Z",
    "limit": 100,
    "match": {
      "type": ["vulnerability"],
      "spec_version": "2.1"
    }
  },
  "clock_skew_bounds": {
    "max_clock_skew_seconds": 60,
    "client_timestamp": "2026-09-04T20:50:00Z",
    "server_timestamp": "2026-09-04T20:50:02Z",
    "max_forward_skew_seconds": 30,
    "max_backward_skew_seconds": 60
  },
  "envelope_status": {
    "status_id": "739f31a2-a6fd-4a8e-93ea-2250f75f1ba0",
    "status": "complete",
    "request_timestamp": "2026-09-04T20:50:00Z",
    "total_count": 5,
    "success_count": 5,
    "failure_count": 0,
    "pending_count": 0
  },
  "pagination": {
    "limit": 100,
    "page_size": 5,
    "total_pages": 1,
    "current_page": 1,
    "has_more": false
  },
  "objects": [
    {
      "type": "vulnerability",
      "spec_version": "2.1",
      "id": "vulnerability--84afb4f0-45a8-4122-8356-fdcf4b434a58",
      "name": "CVE-2024-21413 Microsoft Outlook RCE",
      "description": "Microsoft Outlook Remote Code Execution Vulnerability (MonikerLink)"
    }
  ],
  "data_marking": {
    "classification": "public",
    "tlp": "TLP:CLEAR",
    "handling": []
  },
  "created_at": "2026-09-04T20:50:00Z",
  "digest": "sha256:1111111111111111111111111111111111111111111111111111111111111111"
}
