{
  "feed_id": "taxii_feed_misp_002",
  "tenant_id": "tenant-enterprise-cyber",
  "collection": {
    "id": "639f42b3-a70e-4b9f-94fb-2261e86a2cb1",
    "title": "MISP Community Threat Indicators Feed",
    "description": "TAXII 2.1 collection stream of verified threat indicators from MISP community.",
    "alias": "misp-feed",
    "can_read": true,
    "can_write": true,
    "media_types": ["application/taxii+json;version=2.1", "application/stix+json;version=2.1"]
  },
  "polling_parameters": {
    "added_after": "2026-09-03T12:00:00Z",
    "limit": 500,
    "match": {
      "type": ["indicator", "malware"],
      "spec_version": "2.1"
    }
  },
  "clock_skew_bounds": {
    "max_clock_skew_seconds": 30,
    "client_timestamp": "2026-09-04T20:52:00Z",
    "server_timestamp": "2026-09-04T20:52:01Z",
    "max_forward_skew_seconds": 15,
    "max_backward_skew_seconds": 30
  },
  "envelope_status": {
    "status_id": "84afb4f0-45a8-4122-8356-fdcf4b434a58",
    "status": "complete",
    "request_timestamp": "2026-09-04T20:52:00Z",
    "total_count": 2,
    "success_count": 2,
    "failure_count": 0,
    "pending_count": 0
  },
  "pagination": {
    "limit": 500,
    "page_size": 2,
    "total_pages": 1,
    "current_page": 1,
    "has_more": false
  },
  "objects": [
    {
      "type": "indicator",
      "spec_version": "2.1",
      "id": "indicator--95bac5a1-56b9-4233-9467-0edf5c545b69",
      "pattern": "[file:hashes.'SHA-256' = 'e3b0c44298fc1c149afbf4c8996fb92427ae41e4649b934ca495991b7852b855']",
      "pattern_type": "stix"
    }
  ],
  "data_marking": {
    "classification": "internal",
    "tlp": "TLP:GREEN",
    "handling": ["community-only"]
  },
  "created_at": "2026-09-04T20:52:00Z",
  "digest": "sha256:2222222222222222222222222222222222222222222222222222222222222222"
}
